{
  "algorithm": "cfr_plus",
  "average_strategy": {
    "0:0:air": {
      "bet": 0.500073,
      "check": 0.499927
    },
    "0:0:nut": {
      "bet": 1.0,
      "check": 0.0
    },
    "1:1:catcher": {
      "call": 0.5001,
      "fold": 0.4999
    }
  },
  "checks": [
    {
      "detail": "chips per hand, half-sum convention",
      "kind": "exploitability",
      "pass": true,
      "threshold": 0.0002,
      "value": 4.3323872e-05
    },
    {
      "detail": "mdf_equality: measured 0.5001, expected 0.5",
      "kind": "mdf_equality",
      "pass": true,
      "threshold": 0.002,
      "value": 0.5001
    },
    {
      "detail": "bluff_indifference: measured 0.333366, expected 0.333333",
      "kind": "bluff_indifference",
      "pass": true,
      "threshold": 0.002,
      "value": 0.333365776199
    },
    {
      "detail": "value_bets_always: measured 1, expected 1",
      "kind": "frequency_bounds",
      "pass": true,
      "threshold": 0.001,
      "value": 1.0
    },
    {
      "detail": "toy_game_value: measured 0.25, expected 0.25",
      "kind": "game_value_closed_form",
      "pass": true,
      "threshold": 0.002,
      "value": 0.249999977055
    }
  ],
  "config": {
    "game": "toy_1street_1",
    "measure_every": 160,
    "tree": {
      "deals": 2,
      "decision_nodes": 2,
      "infosets": 3,
      "nodes": 5,
      "terminal_nodes": 3
    }
  },
  "curve": [
    {
      "elapsed_seconds": null,
      "exploitability": 0.0007450344,
      "iteration": 160
    },
    {
      "elapsed_seconds": null,
      "exploitability": 0.0003966977,
      "iteration": 320
    },
    {
      "elapsed_seconds": null,
      "exploitability": 0.000279629,
      "iteration": 480
    },
    {
      "elapsed_seconds": null,
      "exploitability": 0.0002483723,
      "iteration": 640
    },
    {
      "elapsed_seconds": null,
      "exploitability": 0.000168542,
      "iteration": 800
    },
    {
      "elapsed_seconds": null,
      "exploitability": 0.0001724455,
      "iteration": 960
    },
    {
      "elapsed_seconds": null,
      "exploitability": 0.0001368326,
      "iteration": 1120
    },
    {
      "elapsed_seconds": null,
      "exploitability": 0.0001044606,
      "iteration": 1280
    },
    {
      "elapsed_seconds": null,
      "exploitability": 0.0001131315,
      "iteration": 1440
    },
    {
      "elapsed_seconds": null,
      "exploitability": 9.39968e-05,
      "iteration": 1600
    },
    {
      "elapsed_seconds": null,
      "exploitability": 7.42216e-05,
      "iteration": 1760
    },
    {
      "elapsed_seconds": null,
      "exploitability": 7.99902e-05,
      "iteration": 1920
    },
    {
      "elapsed_seconds": null,
      "exploitability": 7.94036e-05,
      "iteration": 2080
    },
    {
      "elapsed_seconds": null,
      "exploitability": 6.34755e-05,
      "iteration": 2240
    },
    {
      "elapsed_seconds": null,
      "exploitability": 6.44828e-05,
      "iteration": 2400
    },
    {
      "elapsed_seconds": null,
      "exploitability": 5.27149e-05,
      "iteration": 2560
    },
    {
      "elapsed_seconds": null,
      "exploitability": 6.36504e-05,
      "iteration": 2720
    },
    {
      "elapsed_seconds": null,
      "exploitability": 5.49399e-05,
      "iteration": 2880
    },
    {
      "elapsed_seconds": null,
      "exploitability": 5.53236e-05,
      "iteration": 3040
    },
    {
      "elapsed_seconds": null,
      "exploitability": 5.26827e-05,
      "iteration": 3200
    },
    {
      "elapsed_seconds": null,
      "exploitability": 4.71628e-05,
      "iteration": 3360
    },
    {
      "elapsed_seconds": null,
      "exploitability": 4.94653e-05,
      "iteration": 3520
    },
    {
      "elapsed_seconds": null,
      "exploitability": 4.33549e-05,
      "iteration": 3680
    },
    {
      "elapsed_seconds": null,
      "exploitability": 4.23456e-05,
      "iteration": 3840
    },
    {
      "elapsed_seconds": null,
      "exploitability": 4.33239e-05,
      "iteration": 4000
    }
  ],
  "determinism_verified": true,
  "exploitability_bb_per_hand": 4.33239e-05,
  "exploitability_threshold": 0.0002,
  "game": "toy_1street",
  "game_description": {
    "en": "One-street bluff-catcher game: its equilibrium frequencies are the closed forms of chapter 02.",
    "zh": "单街诈唬-捕手博弈：均衡频率就是 pot/(pot+bet) 与 bet/(pot+2bet)。"
  },
  "game_value_bb_per_hand": 0.2499999771,
  "id": "solver.toy_1street_1",
  "iterations": 4000,
  "peak_memory_mb": null,
  "proof_entry": "toy_1street_1",
  "provenance": {
    "assumptions": [],
    "confidence": "high",
    "derivation_ref": "src/pokergto/solver/proofs.py#toy_1street_1",
    "kind": "derived",
    "license": "CC-BY-SA-4.0",
    "solver_run": "data/gen/solver/toy_1street_1.json",
    "upstream": null,
    "verified": true
  },
  "schema_version": "1.0.0",
  "seed": 0,
  "timing_seconds": null
}
